{
  "version": 1,
  "name": "Codezal Marketplace",
  "description": "Codezal plugin index / registry — does not host binaries, only SHA-pinned references to upstream repositories.",
  "updatedAt": "2026-05-28T00:00:00Z",
  "plugins": [
    {
      "id": "codezal-test-plugin@codezal-curated",
      "name": "codezal-test-plugin",
      "channel": "codezal-curated",
      "verified": true,
      "manifestPath": "plugins/codezal-test-plugin.json"
    },
    {
      "id": "code-reviewer@codezal-curated",
      "name": "code-reviewer",
      "channel": "codezal-curated",
      "verified": true,
      "manifestPath": "plugins/code-reviewer.json"
    },
    {
      "id": "security-audit@codezal-curated",
      "name": "security-audit",
      "channel": "codezal-curated",
      "verified": true,
      "manifestPath": "plugins/security-audit.json"
    },
    {
      "id": "frontend-craft@codezal-curated",
      "name": "frontend-craft",
      "channel": "codezal-curated",
      "verified": true,
      "manifestPath": "plugins/frontend-craft.json"
    }
  ]
}
